{
  "schema_version": "1.0",
  "kind": "wawalu.paint.editor-import",
  "transfer_id": "aaaaaaaa-aaaa-4aaa-8aaa-aaaaaaaaaaaa",
  "source": {
    "application": "paint",
    "drawing_id": "synthetic-landscape",
    "revision": 7,
    "exported_at": "2026-07-25T12:00:00.000Z"
  },
  "asset": {
    "id": "11111111-1111-4111-8111-111111111111",
    "url": "/api/images/11111111-1111-4111-8111-111111111111/content",
    "content_type": "image/png",
    "byte_size": 68,
    "checksum_sha256": "aaaaaaaaaaaaaaaaaaaaaaaaaaaaaaaaaaaaaaaaaaaaaaaaaaaaaaaaaaaaaaaa"
  },
  "canvas": { "width": 1024, "height": 768 },
  "title": "Synthetic landscape"
}
